{"assurance_tier":"receiver-attested","receipt_jwt":"eyJhbGciOiJFUzI1NiIsInR5cCI6ImFwcGxpY2F0aW9uL2FyZHVyLmVyK2p3dCJ9.eyJhY3Rpb25fY2xhc3MiOiJyZWFkIiwiYWN0b3IiOiJzcGlmZmU6Ly9maXh0dXJlLmFyZHVyLmRldi9hZ2VudC9yZXZpZXdlciIsImFyZ3VtZW50c19oYXNoIjoiMzE0MzU1YmI4YzVmOWFlMWNmMmY0MDk2NzIyMmJmMjIxNjc1NTU5Njg2NDExZDU3ZDA4MjQ5YjkxN2RhMjU5MCIsImJ1ZGdldF9yZW1haW5pbmciOnt9LCJjYW5vbmljYWxpemF0aW9uIjoiamNzLXJmYzg3ODUiLCJldmlkZW5jZV9sZXZlbCI6InNlbGZfc2lnbmVkIiwiZXhwIjoxNzgzNjg3NTAxLCJncmFudF9pZCI6InBhc3Nwb3J0Om1jcC1yZWNlaXZlci1hdHRlc3RhdGlvbi1maXh0dXJlIiwiaWF0IjoxNzgzNjg3MjAxLCJpbnZvY2F0aW9uX2RpZ2VzdCI6eyJhbGciOiJzaGEtMjU2IiwiY2Fub25pY2FsaXphdGlvbiI6Impjcy1yZmM4Nzg1Iiwic2NvcGUiOiJub3JtYWxpemVkX2lucHV0IiwidmFsdWUiOiJsaGNOeHcxT2xYMW5Xc2VMeTduN0hKUE9Sc21RRXgyQ0dUOTV3OG8yVGpnIn0sImlzcyI6InNwaWZmZTovL2ZpeHR1cmUuYXJkdXIuZGV2L2FyZHVyL3ZlcmlmaWVyIiwianRpIjoicmVjZWlwdDpiYWNkZWJiZjk3YjNiOTNkMjFlZWQ1MzcwNmMzODdkMiIsInBhcmVudF9yZWNlaXB0X2hhc2giOm51bGwsInBhcmVudF9yZWNlaXB0X2lkIjpudWxsLCJwb2xpY3lfZGVjaXNpb25zIjpbeyJiYWNrZW5kIjoibmF0aXZlIiwiZGVjaXNpb24iOiJBbGxvdyIsInJlYXNvbiI6InN5bnRoZXRpYyBuby1rZXkgcmVjZWl2ZXItYXR0ZXN0YXRpb24gZml4dHVyZSJ9XSwicmVhc29uIjoic3ludGhldGljIG5vLWtleSByZWNlaXZlci1hdHRlc3RhdGlvbiBmaXh0dXJlIiwicmVjZWlwdF9pZCI6InJlY2VpcHQ6YmFjZGViYmY5N2IzYjkzZDIxZWVkNTM3MDZjMzg3ZDIiLCJyZWNlaXB0X2tpbmQiOiJhY3Rpb24iLCJyZXNvdXJjZV9mYW1pbHkiOiJmaWxlc3lzdGVtIiwicnVuX25vbmNlIjoibWNwX3JlY2VpdmVyX2ZpeHR1cmVfbm9uY2VfMDEyMzQ1Njc4OSIsInNjaGVtYV92ZXJzaW9uIjoiYXJkdXIuZXhlY3V0aW9uX3JlY2VpcHQudjAuMiIsInNpZGVfZWZmZWN0X2NsYXNzIjoibm9uZSIsInN0ZXBfaWQiOiJzdGVwOm1jcC1yZWNlaXZlci1hdHRlc3RhdGlvbi1maXh0dXJlIiwidGFyZ2V0Ijoid29ya3NwYWNlL3B1YmxpYy1maXh0dXJlLnR4dCIsInRpbWVzdGFtcCI6IjIwMjYtMDctMTBUMTI6NDA6MDFaIiwidG9vbCI6InJlYWRfZmlsZSIsInRyYWNlX2lkIjoidHJhY2U6bWNwLXJlY2VpdmVyLWF0dGVzdGF0aW9uLWZpeHR1cmUiLCJ2ZXJkaWN0IjoiY29tcGxpYW50IiwidmVyaWZpZXJfaWQiOiJzcGlmZmU6Ly9maXh0dXJlLmFyZHVyLmRldi9hcmR1ci92ZXJpZmllciJ9.MXFtxVh0SzTn7FbPPl-sYkovjO_uWr_8ddelQ71tSXQEwL7eO73Ecb_3_ORVBiLmt19tVETxS6w8FSw-Jdtg0A","receipt_subject":{"digest":{"algorithm":"sha256","value":"cac18d39ee41fcbd7ec9de26b0de97eaf3a417cd2d8a2b853290bd3dc8025437"},"media_type":"application/ardur.er+jwt"},"receiver_attestation":{"format":"application/ardur.receiver-attestation+jwt","key_id":"fixture-read-file:v1","receiver_id":"spiffe://fixture.ardur.dev/tool/read-file","statement_jws":"eyJhbGciOiJFUzI1NiIsImtpZCI6ImZpeHR1cmUtcmVhZC1maWxlOnYxIiwidHlwIjoiYXBwbGljYXRpb24vYXJkdXIucmVjZWl2ZXItYXR0ZXN0YXRpb24rand0In0.eyJhY3Rpb25faWQiOiJyZWNlaXB0OmJhY2RlYmJmOTdiM2I5M2QyMWVlZDUzNzA2YzM4N2QyIiwiYXR0ZXN0YXRpb25faWQiOiJyZWNlaXZlci1hdHRlc3RhdGlvbjo0ZjExNmRjYmU3ZTVjMDVjN2RjYmUyN2VkMjBlODA1ZDc3MWJlOWZjNWVmOGY3NzQ3NTIxYmFiZDI0YTYyODQxIiwiYXV0aG9yaXR5X3N1bW1hcnkiOnsiYWN0aW9uX2NsYXNzIjoicmVhZCIsImFjdG9yIjoic3BpZmZlOi8vZml4dHVyZS5hcmR1ci5kZXYvYWdlbnQvcmV2aWV3ZXIiLCJncmFudF9pZCI6InBhc3Nwb3J0Om1jcC1yZWNlaXZlci1hdHRlc3RhdGlvbi1maXh0dXJlIiwicmVzb3VyY2VfZmFtaWx5IjoiZmlsZXN5c3RlbSIsInNpZGVfZWZmZWN0X2NsYXNzIjoibm9uZSIsInRhcmdldCI6IndvcmtzcGFjZS9wdWJsaWMtZml4dHVyZS50eHQiLCJ2ZXJkaWN0IjoiY29tcGxpYW50IiwidmVyaWZpZXJfaWQiOiJzcGlmZmU6Ly9maXh0dXJlLmFyZHVyLmRldi9hcmR1ci92ZXJpZmllciJ9LCJjYW5vbmljYWxpemF0aW9uIjoiamNzLXJmYzg3ODUiLCJpYXQiOjE3ODM2ODcyMDIsImludm9jYXRpb25fZGlnZXN0Ijp7ImFsZyI6InNoYS0yNTYiLCJjYW5vbmljYWxpemF0aW9uIjoiamNzLXJmYzg3ODUiLCJzY29wZSI6Im5vcm1hbGl6ZWRfaW5wdXQiLCJ2YWx1ZSI6ImxoY054dzFPbFgxbldzZUx5N243SEpQT1JzbVFFeDJDR1Q5NXc4bzJUamcifSwianRpIjoiRk5mRkVYLTBUVnpOeFRESVdRbER3d3c1Iiwib2JzZXJ2ZWRfYXQiOiIyMDI2LTA3LTEwVDEyOjQwOjAyWiIsInJlY2VpcHRfaWQiOiJyZWNlaXB0OmJhY2RlYmJmOTdiM2I5M2QyMWVlZDUzNzA2YzM4N2QyIiwicmVjZWlwdF9zdWJqZWN0Ijp7ImRpZ2VzdCI6eyJhbGdvcml0aG0iOiJzaGEyNTYiLCJ2YWx1ZSI6ImNhYzE4ZDM5ZWU0MWZjYmQ3ZWM5ZGUyNmIwZGU5N2VhZjNhNDE3Y2QyZDhhMmI4NTMyOTBiZDNkYzgwMjU0MzcifSwibWVkaWFfdHlwZSI6ImFwcGxpY2F0aW9uL2FyZHVyLmVyK2p3dCJ9LCJyZWNlaXZlcl9pZCI6InNwaWZmZTovL2ZpeHR1cmUuYXJkdXIuZGV2L3Rvb2wvcmVhZC1maWxlIiwicmVxdWVzdF9kaWdlc3QiOnsiYWxnIjoic2hhLTI1NiIsImNhbm9uaWNhbGl6YXRpb24iOiJqY3MtcmZjODc4NSIsInNjb3BlIjoibWNwX3Rvb2xzX2NhbGwiLCJ2YWx1ZSI6IjlnSmVxR1lKMC0yVXktZmN0NmN2SWtVM1F1TTY0OHFqeVgwZUxZYnA5U28ifSwicmVzcG9uc2VfZGlnZXN0Ijp7ImFsZyI6InNoYS0yNTYiLCJjYW5vbmljYWxpemF0aW9uIjoiamNzLXJmYzg3ODUiLCJzY29wZSI6Im1jcF90b29sc19jYWxsX3Jlc3VsdCIsInZhbHVlIjoienliNVd5OUhoME8ydnV4bkpLdlZST1ZfRWVGTi1tVHVfM1o1X01Hczc3MCJ9LCJyZXN1bHRfc3RhdHVzIjoic3VjY2VzcyIsInNjaGVtYV92ZXJzaW9uIjoiYXJkdXIucmVjZWl2ZXJfYXR0ZXN0YXRpb25fc3RhdGVtZW50LnYwLjEiLCJzdGVwX2lkIjoic3RlcDptY3AtcmVjZWl2ZXItYXR0ZXN0YXRpb24tZml4dHVyZSJ9.7tmsfWhyEfQTmOSYIxEVIGjAZ1w2eQpnE0Uc5tSDLNPgn6xpFnuajoRwXoAztw05ClKl5Z-2vUzfMxcLaVdtoA"},"schema_version":"ardur.receiver_attestation.v0.1"}
